{
  "$schema": "./schemas/people.schema.json",
  "schemaVersion": 1,
  "lastVerified": "2026-10-16",
  "methodology": "Current roles are published only from the organization and Chapter's public records. A missing start date is shown as not publicly established rather than inferred from a first commit. Project-maintainer, alumni, and advisor records remain empty until the role, period, scope, and public evidence have been verified.",
  "correctionUrl": "https://github.com/elixpo/elixpo/issues/new",
  "consentPolicy": {
    "url": "https://github.com/elixpo/elixpo/blob/main/docs/policies/people-and-profile-consent.md",
    "defaultBasis": "public-evidence-only",
    "publicEvidenceRule": "Names, public GitHub profile images, public handles, and attributable public work may be summarized conservatively when the source is linked and no sensitive or non-public detail is added.",
    "explicitConsentRule": "Custom biographies, non-public role details, private contact information, supplied photography, and any statement extending beyond public evidence require recorded opt-in consent before publication.",
    "removalRule": "A person may request correction or removal through the published correction route; disputed optional profile material is hidden while reviewed.",
    "currentPublicationResolution": "Every currently published person record uses public-evidence-only as its basis. Images are public GitHub profile images, summaries are bounded by linked public work, and no supplied photography, private contact information, non-public role date, departure explanation, testimonial, or private biography is published. Optional material remains withheld until recorded opt-in exists."
  },
  "roleDefinitions": {
    "currentTeam": "People with continuing organization-level responsibility recorded in Elixpo's public materials.",
    "projectMaintainers": "People accountable for the direction, review, releases, and support of a named project; this is narrower than organization membership.",
    "researchContributors": "People with attributable work in Elixpo research repositories who are not thereby presented as organization leads, employees, or formal reviewers.",
    "majorContributors": "People recognized through attributable public outcomes under the separate evidence-led contributor policy, excluding declared leads and automation.",
    "alumni": "People whose previously verified Elixpo role has ended; an alumni record never implies a reason for departure.",
    "advisors": "People with an explicitly acknowledged advisory relationship; informal help or one-time review does not create this role."
  },
  "currentTeam": [
    {
      "handle": "Circuit-Overtime",
      "name": "Ayushman Bhattacharya",
      "role": "Founder, project lead and maintainer",
      "summary": "Coordinates Elixpo's technical direction, public releases, research surfaces, organization operations, and the shared project-foundry programme.",
      "github": "https://github.com/Circuit-Overtime",
      "portfolio": "https://me.elixpo.com/ayushman",
      "profileSource": "public-evidence-only",
      "rolePeriod": { "start": null, "end": null, "status": "current", "precision": "not-publicly-established" },
      "evidence": ["https://github.com/elixpo", "https://github.com/elixpo/elixpo_chapter"]
    },
    {
      "handle": "ez-vivek",
      "name": "Vivek Yadav",
      "role": "Lead developer",
      "summary": "Works across Chapter engineering and project delivery, helping move shared implementation work into reviewed public releases.",
      "github": "https://github.com/ez-vivek",
      "portfolio": "https://me.elixpo.com/vivek",
      "profileSource": "public-evidence-only",
      "rolePeriod": { "start": null, "end": null, "status": "current", "precision": "not-publicly-established" },
      "evidence": ["https://github.com/elixpo", "https://github.com/elixpo/elixpo_chapter/commits?author=ez-vivek"]
    },
    {
      "handle": "anwe-ch",
      "name": "Anwesha Chakraborty",
      "role": "Research and engineering lead",
      "summary": "Connects open research with implementation through published studies, technical review, project development, and organization-level stewardship.",
      "github": "https://github.com/anwe-ch",
      "portfolio": "https://me.elixpo.com/anwesha",
      "profileSource": "public-evidence-only",
      "rolePeriod": { "start": null, "end": null, "status": "current", "precision": "not-publicly-established" },
      "evidence": ["https://github.com/elixpo", "https://github.com/elixpo/elixpo_chapter/commits?author=anwe-ch"]
    }
  ],
  "projectMaintainers": [],
  "researchContributors": [
    {
      "handle": "nihal-gazi",
      "name": "Nihal Gazi",
      "role": "Research contributor",
      "summary": "Contributes to MonoDiffuse and Wozformer research work, including early research material, documentation, diagrams, and LaTeX publication fixes.",
      "github": "https://github.com/nihal-gazi",
      "portfolio": null,
      "profileSource": "public-evidence-only",
      "rolePeriod": { "start": null, "end": null, "status": "current", "precision": "not-publicly-established" },
      "evidence": [
        "https://github.com/elixpo/monodiffuse/commit/109bda407938e8287ceca9d58d86d6f9d456f32f",
        "https://github.com/elixpo/wozformer/commit/ab80d5d90da2bc4e39598d35f6827e2dd077a8f1"
      ],
      "relatedResearch": ["monodiffuse", "wozformer"]
    }
  ],
  "majorContributors": {
    "source": "contributors.json",
    "url": "https://elixpo.com/contributors"
  },
  "alumni": [],
  "advisors": []
}
